{
  "presetId": "chrome-android150",
  "platform": "android",
  "family": "chrome-android",
  "major": 150,
  "stack": "chromium-boringssl",
  "stackVersion": null,
  "status": "pending-capture",
  "alignment": "recipe",
  "source": {
    "kind": "pending",
    "tool": null,
    "environment": null,
    "capturedAt": null
  },
  "golden": {
    "ja3": null,
    "ja3Raw": null,
    "ja4": null,
    "ja4Raw": null,
    "clientHelloHex": null
  },
  "notes": "P2. MUST be captured on a real device or emulator. Reusing the desktop chrome150 golden here is explicitly forbidden (plan section 4.4)."
}
