{
  "presetId": "chrome131",
  "platform": "desktop-linux",
  "family": "chrome",
  "major": 131,
  "stack": "chromium-boringssl",
  "stackVersion": null,
  "status": "pending-capture",
  "alignment": "recipe",
  "source": {
    "kind": "pending",
    "tool": null,
    "environment": null,
    "capturedAt": null
  },
  "golden": {
    "ja3": null,
    "ja3Raw": null,
    "ja4": null,
    "ja4Raw": null,
    "clientHelloHex": null
  },
  "notes": "Multi-platform companion for chrome131. Capture per OS; do not reuse windows golden."
}
