{
  "presetId": "safari-ios18",
  "platform": "ios",
  "family": "safari-ios",
  "major": 18,
  "stack": "apple-network",
  "stackVersion": null,
  "status": "pending-capture",
  "alignment": "recipe",
  "source": {
    "kind": "pending",
    "tool": null,
    "environment": null,
    "capturedAt": null
  },
  "golden": {
    "ja3": null,
    "ja3Raw": null,
    "ja4": null,
    "ja4Raw": null,
    "clientHelloHex": null
  },
  "notes": "P2. Safari iOS uses Apple Network.framework, NOT BoringSSL. Bit-level JA3 parity may prove infeasible; capture the golden first, then decide (plan D3)."
}
