{
  "presetId": "chrome150",
  "platform": "desktop-windows",
  "family": "chrome",
  "major": 150,
  "stack": "chromium-boringssl",
  "stackVersion": "utls HelloChrome_102 (pinned, pre-shuffle) via tools/utls-chrome-dial",
  "status": "captured",
  "alignment": "tool-matched",
  "source": {
    "kind": "tool-capture",
    "tool": "utls-chrome-dial (refraction-networking/utls HelloChrome_102)",
    "environment": "impersonate=chrome150→hello chrome102 pinned; probe=loopback; host=win32",
    "capturedAt": "2026-08-05"
  },
  "golden": {
    "ja3": "cd08e31494f9531f560d64c695473da9",
    "ja3Raw": "771,4865-4866-4867-49195-49199-49196-49200-52393-52392-49171-49172-156-157-47-53,0-23-65281-10-11-35-16-5-13-18-51-45-43-27-17513-21,29-23-24,0",
    "ja4": "t13d1516h2_8daaf6152771_e5627efa2ab1",
    "ja4Raw": "t13d1516h2_002f,0035,009c,009d,1301,1302,1303,c013,c014,c02b,c02c,c02f,c030,cca8,cca9_0005,000a,000b,000d,0012,0015,0017,001b,0023,002b,002d,0033,4469,ff01_0403,0804,0401,0503,0805,0501,0806,0601",
    "clientHelloHex": "1603010200010001fc030394c37626472b046b2d3462c25a254580949fa777d0a99fad8f18e66ff346457020d89d1042190b79bb2570de9a207a6c6ddc931fa3432deb95657ad4f083f3c6fb00202a2a130113021303c02bc02fc02cc030cca9cca8c013c014009c009d002f0035010001932a2a000000000010000e00000b70726f62652e6c6f63616c00170000ff01000100000a000a00089a9a001d00170018000b00020100002300000010000e000c02683208687474702f312e31000500050100000000000d0012001004030804040105030805050108060601001200000033002b00299a9a000100001d00201a9f3d5fb3ac6bd492c350ee36a9f5e4da0c9c4ddd185d9afa5c1f2b035cdd15002d00020101002b000706eaea03040303001b00030200024469000500030268326a6a000100001500cc000000000000000000000000000000000000000000000000000000000000000000000000000000000000000000000000000000000000000000000000000000000000000000000000000000000000000000000000000000000000000000000000000000000000000000000000000000000000000000000000000000000000000000000000000000000000000000000000000000000000000000000000000000000000000000000000000000000000000000000000000000000000000000000000000000000000000000000000"
  },
  "notes": "P0 tool-matched via utls HelloChrome_102 (pinned pre-shuffle so JA3 re-measures equal). Product preset id remains chrome150; not browser-matched. Gate also accepts JA4 equality when extension-order permutes on other stacks."
}
