{
  "presetId": "chrome150",
  "platform": "desktop-linux",
  "family": "chrome",
  "major": 150,
  "stack": "chromium-boringssl",
  "stackVersion": null,
  "status": "pending-capture",
  "alignment": "recipe",
  "source": {
    "kind": "pending",
    "tool": null,
    "environment": null,
    "capturedAt": null
  },
  "golden": {
    "ja3": null,
    "ja3Raw": null,
    "ja4": null,
    "ja4Raw": null,
    "clientHelloHex": null
  },
  "notes": "P0. CI probe environment."
}
