{
  "presetId": "chrome-android131",
  "platform": "android",
  "family": "chrome-android",
  "major": 131,
  "stack": "chromium-boringssl",
  "stackVersion": null,
  "status": "pending-capture",
  "alignment": "recipe",
  "source": {
    "kind": "pending",
    "tool": null,
    "environment": null,
    "capturedAt": null
  },
  "golden": {
    "ja3": null,
    "ja3Raw": null,
    "ja4": null,
    "ja4Raw": null,
    "clientHelloHex": null
  },
  "notes": "Android multi-version stub. Must capture on device/emulator; never reuse desktop chrome131."
}
